<?xml version="1.0" encoding="iso-8859-1"?>
<!DOCTYPE library SYSTEM "library.dtd">
<!-- autogenerated by fdtrans v50.9 -->
<library name="cardres" basename="CardResource" openname="include/cardres.library">
	<include>exec/types.h</include>
	<include>exec/resident.h</include>
	<include>resources/card.h</include>
	<interface name="main" version="1.0" struct="CardIFace" prefix="_Card_" asmprefix="ICard" global="ICard">
		<method name="Obtain" result="ULONG"/>
		<method name="Release" result="ULONG"/>
		<method name="Expunge" result="void" status="unimplemented"/>
		<method name="Clone" result="struct Interface *" status="unimplemented"/>
		<method name="OwnCard" result="struct CardHandle *">
			<arg name="handle" type="struct CardHandle *"/>
		</method>
		<method name="ReleaseCard" result="VOID">
			<arg name="handle" type="struct CardHandle *"/>
			<arg name="flags" type="ULONG"/>
		</method>
		<method name="GetCardMap" result="struct CardMemoryMap *">
		</method>
		<method name="BeginCardAccess" result="BOOL">
			<arg name="handle" type="struct CardHandle *"/>
		</method>
		<method name="EndCardAccess" result="BOOL">
			<arg name="handle" type="struct CardHandle *"/>
		</method>
		<method name="ReadCardStatus" result="UBYTE">
		</method>
		<method name="CardResetRemove" result="BOOL">
			<arg name="handle" type="struct CardHandle *"/>
			<arg name="flag" type="ULONG"/>
		</method>
		<method name="CardMiscControl" result="UBYTE">
			<arg name="handle" type="struct CardHandle *"/>
			<arg name="control_bits" type="UBYTE"/>
		</method>
		<method name="CardAccessSpeed" result="ULONG">
			<arg name="handle" type="struct CardHandle *"/>
			<arg name="nanoseconds" type="ULONG"/>
		</method>
		<method name="CardProgramVoltage" result="LONG">
			<arg name="handle" type="struct CardHandle *"/>
			<arg name="voltage" type="ULONG"/>
		</method>
		<method name="CardResetCard" result="BOOL">
			<arg name="handle" type="struct CardHandle *"/>
		</method>
		<method name="CopyTuple" result="BOOL">
			<arg name="handle" type="const struct CardHandle *"/>
			<arg name="buffer" type="UBYTE *"/>
			<arg name="tuplecode" type="ULONG"/>
			<arg name="size" type="ULONG"/>
		</method>
		<method name="DeviceTuple" result="ULONG">
			<arg name="tuple_data" type="const UBYTE *"/>
			<arg name="storage" type="struct DeviceTData *"/>
		</method>
		<method name="IfAmigaXIP" result="struct Resident *">
			<arg name="handle" type="const struct CardHandle *"/>
		</method>
		<method name="CardForceChange" result="BOOL">
		</method>
		<method name="CardChangeCount" result="ULONG">
		</method>
		<method name="CardInterface" result="ULONG">
		</method>
	</interface>
</library>
