<?xml version="1.0" encoding="iso-8859-1"?>
<!DOCTYPE library SYSTEM "library.dtd">
<library name="bootsd" basename="BootSDBase" openname="bootsd.resource">
<interface name="main" version="1.0" flags="protected" struct="BootSDIFace" prefix="_bootsd_" global="IBootSD">

<method name="Obtain" result="uint32"></method>
<method name="Release" result="uint32"></method>
<method name="Expunge" result="void" status="unimplemented"></method>
<method name="Clone" result="struct Interface *" status="unimplemented"></method>

<method name="AllocResource" result="APTR">
	<arg name="error" type="int32 *"/>
</method>

<method name="FreeResource" result="BOOL">
	<arg name="unit" type="APTR"/>
</method>

<method name="GetGeometry" result="APTR">
	<arg name="unit" type="APTR"/>
	<arg name="error" type="int32 *"/>
	<arg name="geom" type ="struct DosEnvec *"/>
</method>

<method name="ReadSDCard" result="uint32">
	<arg name="unit" type="APTR"/>
	<arg name="error" type="int32 *"/>
	<arg name="buffer" type="APTR"/>
	<arg name="startBlock" type ="uint32"/>
	<arg name="numBlocks" type ="uint32"/>
</method>

<method name="WriteSDCard" result="uint32">
	<arg name="unit" type="APTR"/>
	<arg name="error" type="int32 *"/>
	<arg name="buffer" type="APTR"/>
	<arg name="startBlock" type ="uint32"/>
	<arg name="numBlocks" type ="uint32"/>
</method>

</interface>
</library>

