<?xml version="1.0" encoding="iso-8859-1"?>
<!DOCTYPE library SYSTEM "library.dtd">
<library name="layout" basename="LayoutBase" classname="LayoutClass" openname="gadgets/layout.gadget">
	<include>intuition/intuition.h</include>
	<include>intuition/classes.h</include>
	<include>gadgets/layout.h</include>
	<interface name="main" version="1.0" struct="LayoutIFace" prefix="_Layout_" asmprefix="ILayout" global="ILayout">
		<method name="Obtain" result="ULONG"/>
		<method name="Release" result="ULONG"/>
		<method name="Expunge" result="void" status="unimplemented"/>
		<method name="Clone" result="struct Interface *" status="unimplemented"/>
		<method name="LAYOUT_GetClass" result="Class *">
		</method>
		<method name="ActivateLayoutGadget" result="BOOL">
			<arg name="gadget" type="struct Gadget *"/>
			<arg name="window" type="struct Window *"/>
			<arg name="requester" type="struct Requester *"/>
			<arg name="object" type="ULONG"/>
		</method>
		<method name="FlushLayoutDomainCache" result="VOID">
			<arg name="gadget" type="struct Gadget *"/>
		</method>
		<method name="RethinkLayout" result="BOOL">
			<arg name="gadget" type="struct Gadget *"/>
			<arg name="window" type="struct Window *"/>
			<arg name="requester" type="struct Requester *"/>
			<arg name="refresh" type="BOOL"/>
		</method>
		<method name="LayoutLimits" result="VOID">
			<arg name="gadget" type="struct Gadget *"/>
			<arg name="limits" type="struct LayoutLimits *"/>
			<arg name="font" type="struct TextFont *"/>
			<arg name="screen" type="struct Screen *"/>
		</method>
		<method name="PAGE_GetClass" result="Class *">
		</method>
		<method name="SetPageGadgetAttrsA" result="ULONG">
			<arg name="gadget" type="struct Gadget *"/>
			<arg name="object" type="Object *"/>
			<arg name="window" type="struct Window *"/>
			<arg name="requester" type="struct Requester *"/>
			<arg name="tags" type="struct TagItem *"/>
		</method>
		<method name="SetPageGadgetAttrs" result="ULONG">
			<arg name="gadget" type="struct Gadget *"/>
			<arg name="object" type="Object *"/>
			<arg name="window" type="struct Window *"/>
			<arg name="requester" type="struct Requester *"/>
			<vararg name="tag1" type="Tag"/>
		</method>
		<method name="RefreshPageGadget" result="VOID">
			<arg name="gadget" type="struct Gadget *"/>
			<arg name="object" type="Object *"/>
			<arg name="window" type="struct Window *"/>
			<arg name="requester" type="struct Requester *"/>
		</method>
	</interface>
</library>
