<?xml version="1.0" encoding="iso-8859-1"?>
<!DOCTYPE library SYSTEM "library.dtd">
<!-- autogenerated by fdtrans v51.19 -->
<library name="textclip" basename="TextClipBase" openname="textclip.library">
	<include>exec/types.h</include>
	<interface name="main" version="1.0" struct="TextClipIFace" prefix="_TextClip_" asmprefix="ITextClip" global="ITextClip">
		<method name="Obtain" result="ULONG"/>
		<method name="Release" result="ULONG"/>
		<method name="Expunge" result="void" status="unimplemented"/>
		<method name="Clone" result="struct Interface *" status="unimplemented"/>
		<method name="WriteClipVector" result="LONG">
			<arg name="vector" type="CONST_STRPTR"/>
			<arg name="size" type="ULONG"/>
		</method>
		<method name="ReadClipVector" result="LONG">
			<arg name="bufptr" type="STRPTR *"/>
			<arg name="sizptr" type="ULONG *"/>
		</method>
		<method name="DisposeClipVector" result="VOID">
			<arg name="vector" type="STRPTR"/>
		</method>
	</interface>
</library>
