<?xml version="1.0" encoding="iso-8859-1"?>
<!DOCTYPE library SYSTEM "library.dtd">
<!-- autogenerated by fdtrans v50.8 -->
<library name="lowlevel" basename="LowLevelBase" openname="lowlevel.library">
	<include>exec/types.h</include>
	<include>exec/interrupts.h</include>
	<include>utility/tagitem.h</include>
	<include>devices/timer.h</include>
	<include>libraries/lowlevel.h</include>
	<interface name="main" version="1.0" struct="LowLevelIFace" prefix="_LowLevel_" asmprefix="ILowLevel" global="ILowLevel">
		<method name="Obtain" result="ULONG"/>
		<method name="Release" result="ULONG"/>
		<method name="Expunge" result="void" status="unimplemented"/>
		<method name="Clone" result="struct Interface *" status="unimplemented"/>
		<method name="ReadJoyPort" result="ULONG">
			<arg name="port" type="ULONG"/>
		</method>
		<method name="GetLanguageSelection" result="UBYTE">
		</method>
		<method name="SetLanguageSelection" result="VOID" status="private">
			<arg name="language" type="ULONG"/>
		</method>
		<method name="GetKey" result="ULONG">
		</method>
		<method name="QueryKeys" result="VOID">
			<arg name="queryArray" type="struct KeyQuery *"/>
			<arg name="arraySize" type="UBYTE"/>
		</method>
		<method name="AddKBInt" result="APTR">
			<arg name="intRoutine" type="const APTR"/>
			<arg name="intData" type="const APTR"/>
		</method>
		<method name="RemKBInt" result="VOID">
			<arg name="intHandle" type="APTR"/>
		</method>
		<method name="SystemControlA" result="ULONG">
			<arg name="tagList" type="const struct TagItem *"/>
		</method>
		<method name="SystemControl" result="ULONG">
			<vararg name="firstTag" type="Tag"/>
		</method>
		<method name="AddTimerInt" result="APTR">
			<arg name="intRoutine" type="const APTR"/>
			<arg name="intData" type="const APTR"/>
		</method>
		<method name="RemTimerInt" result="VOID">
			<arg name="intHandle" type="APTR"/>
		</method>
		<method name="StopTimerInt" result="VOID">
			<arg name="intHandle" type="APTR"/>
		</method>
		<method name="StartTimerInt" result="VOID">
			<arg name="intHandle" type="APTR"/>
			<arg name="timeInterval" type="ULONG"/>
			<arg name="continuous" type="BOOL"/>
		</method>
		<method name="ElapsedTime" result="ULONG">
			<arg name="context" type="struct EClockVal *"/>
		</method>
		<method name="AddVBlankInt" result="APTR">
			<arg name="intRoutine" type="const APTR"/>
			<arg name="intData" type="const APTR"/>
		</method>
		<method name="RemVBlankInt" result="VOID">
			<arg name="intHandle" type="APTR"/>
		</method>
		<method name="KillReq" result="VOID" status="private">
		</method>
		<method name="RestoreReq" result="VOID" status="private">
		</method>
		<method name="SetJoyPortAttrsA" result="BOOL">
			<arg name="portNumber" type="ULONG"/>
			<arg name="tagList" type="const struct TagItem *"/>
		</method>
		<method name="SetJoyPortAttrs" result="BOOL">
			<arg name="portNumber" type="ULONG"/>
			<vararg name="firstTag" type="Tag"/>
		</method>
	</interface>
</library>
