<?xml version="1.0" encoding="iso-8859-1"?>
<!DOCTYPE library SYSTEM "library.dtd">
<!-- autogenerated by fdtrans v52.1 -->
<library name="btree" basename="BTreeBase" basetype="Library" openname="btree.library">
	<include>exec/types.h</include>
	<include>libraries/btree.h</include>
	<interface name="main" version="1.0" struct="BTreeIFace" prefix="_BTree_" asmprefix="IBTree" global="IBTree">
		<method name="Obtain" result="uint32"/>
		<method name="Release" result="uint32"/>
		<method name="Expunge" result="void" status="unimplemented"/>
		<method name="Clone" result="struct Interface *" status="unimplemented"/>
		<method name="CreateTree" result="APTR">
			<arg name="Type" type="ULONG"/>
			<arg name="argArray" type="const struct BTArgArray *"/>
		</method>
		<method name="DeleteTree" result="void">
			<arg name="Tree" type="APTR"/>
		</method>
		<method name="InsertTreeNode" result="APTR">
			<arg name="Tree" type="APTR"/>
			<arg name="Key" type="CONST_APTR"/>
			<arg name="Data" type="CONST_APTR"/>
		</method>
		<method name="DeleteTreeNode" result="void">
			<arg name="Tree" type="APTR"/>
			<arg name="Node" type="APTR"/>
		</method>
		<method name="GetTreeNodeKey" result="APTR">
			<arg name="Tree" type="CONST_APTR"/>
			<arg name="Node" type="CONST_APTR"/>
		</method>
		<method name="GetTreeNodeData" result="APTR">
			<arg name="Tree" type="CONST_APTR"/>
			<arg name="Node" type="CONST_APTR"/>
		</method>
		<method name="SuccTreeNode" result="APTR">
			<arg name="Tree" type="CONST_APTR"/>
			<arg name="Node" type="CONST_APTR"/>
		</method>
		<method name="PredTreeNode" result="APTR">
			<arg name="Tree" type="CONST_APTR"/>
			<arg name="Node" type="CONST_APTR"/>
		</method>
		<method name="MinTreeNode" result="APTR">
			<arg name="Tree" type="CONST_APTR"/>
		</method>
		<method name="MaxTreeNode" result="APTR">
			<arg name="Tree" type="CONST_APTR"/>
		</method>
		<method name="FindTreeNodeByKey" result="APTR">
			<arg name="Tree" type="CONST_APTR"/>
			<arg name="Key" type="CONST_APTR"/>
		</method>
		<method name="FindTreeNodeByData" result="APTR">
			<arg name="Tree" type="CONST_APTR"/>
			<arg name="Data" type="CONST_APTR"/>
		</method>
		<method name="ForTreeNodes" result="ULONG">
			<arg name="Tree" type="CONST_APTR"/>
			<arg name="nodeFunc" type="void (*)(APTR userData, CONST_APTR Node)"/>
			<arg name="userData" type="CONST_APTR"/>
		</method>
		<method name="EnumTreeNodes" result="ULONG">
			<arg name="Tree" type="CONST_APTR"/>
			<arg name="lowKey" type="CONST_APTR"/>
			<arg name="highKey" type="CONST_APTR"/>
			<arg name="nodeFunc" type="LONG (*)(APTR userData, CONST_APTR Node)"/>
			<arg name="userData" type="CONST_APTR"/>
		</method>
		<method name="GetTreeSize" result="ULONG">
			<arg name="Tree" type="CONST_APTR"/>
		</method>
		<method name="GetTreeHeight" result="ULONG">
			<arg name="Tree" type="CONST_APTR"/>
		</method>
		<method name="FlushTree" result="void">
			<arg name="Tree" type="APTR"/>
		</method>
		<method name="SetTreeNodeData" result="APTR">
			<arg name="Tree" type="CONST_APTR"/>
			<arg name="Node" type="APTR"/>
			<arg name="NewData" type="CONST_APTR"/>
		</method>
	</interface>
</library>
