<?xml version="1.0" encoding="iso-8859-1"?>
<!DOCTYPE library SYSTEM "library.dtd">
<library name="cybergraphics" basename="CyberGfxBase" openname="cybergraphics.library">
	<include>exec/lists.h</include>
	<include>graphics/rastport.h</include>
	<include>graphics/view.h</include>
	<include>utility/tagitem.h</include>
	<include>utility/hooks.h</include>
	<interface name="main" version="1.0" struct="CyberGfxIFace" prefix="_CyberGfx_" asmprefix="ICyberGfx" global="ICyberGfx">
		<method name="Obtain" result="ULONG"/>
		<method name="Release" result="ULONG"/>
		<method name="Expunge" result="void" status="unimplemented"/>
		<method name="Clone" result="struct Interface *" status="unimplemented"/>
		<method name="Reserved1" result="void" status="unimplemented"/>
		<method name="Reserved2" result="void" status="unimplemented"/>
		<method name="Reserved3" result="void" status="unimplemented"/>
		<method name="Reserved4" result="void" status="unimplemented"/>
		<method name="IsCyberModeID" result="BOOL">
			<arg name="displayID" type="ULONG"/>
		</method>
		<method name="BestCModeIDTagList" result="ULONG">
			<arg name="BestModeIDTags" type="struct TagItem *"/>
		</method>
		<method name="BestCModeIDTags" result="ULONG">
			<vararg name="tag1" type="Tag"/>
		</method>
		<method name="CModeRequestTagList" result="ULONG">
			<arg name="ModeRequest" type="APTR"/>
			<arg name="ModeRequestTags" type="struct TagItem *"/>
		</method>
		<method name="CModeRequestTags" result="ULONG">
			<arg name="ModeRequest" type="APTR"/>
			<vararg name="tag1" type="Tag"/>
		</method>
		<method name="AllocCModeListTagList" result="struct List *">
			<arg name="ModeListTags" type="struct TagItem *"/>
		</method>
		<method name="AllocCModeListTags" result="struct List *">
			<vararg name="tag1" type="Tag"/>
		</method>
		<method name="FreeCModeList" result="VOID">
			<arg name="ModeList" type="struct List *"/>
		</method>
		<method name="Reserved5" result="void" status="unimplemented"/>
		<method name="ScalePixelArray" result="LONG">
			<arg name="srcRect" type="APTR"/>
			<arg name="SrcW" type="UWORD"/>
			<arg name="SrcH" type="UWORD"/>
			<arg name="SrcMod" type="UWORD"/>
			<arg name="RastPort" type="struct RastPort *"/>
			<arg name="DestX" type="UWORD"/>
			<arg name="DestY" type="UWORD"/>
			<arg name="DestW" type="UWORD"/>
			<arg name="DestH" type="UWORD"/>
			<arg name="SrcFormat" type="UBYTE"/>
		</method>
		<method name="GetCyberMapAttr" result="ULONG">
			<arg name="CyberGfxBitmap" type="struct BitMap *"/>
			<arg name="CyberAttrTag" type="ULONG"/>
		</method>
		<method name="GetCyberIDAttr" result="ULONG">
			<arg name="CyberIDAttr" type="ULONG"/>
			<arg name="CyberDisplayModeID" type="ULONG"/>
		</method>
		<method name="ReadRGBPixel" result="ULONG">
			<arg name="RastPort" type="struct RastPort *"/>
			<arg name="x" type="UWORD"/>
			<arg name="y" type="UWORD"/>
		</method>
		<method name="WriteRGBPixel" result="LONG">
			<arg name="RastPort" type="struct RastPort *"/>
			<arg name="x" type="UWORD"/>
			<arg name="y" type="UWORD"/>
			<arg name="argb" type="ULONG"/>
		</method>
		<method name="ReadPixelArray" result="ULONG">
			<arg name="destRect" type="APTR"/>
			<arg name="destX" type="UWORD"/>
			<arg name="destY" type="UWORD"/>
			<arg name="destMod" type="UWORD"/>
			<arg name="RastPort" type="struct RastPort *"/>
			<arg name="SrcX" type="UWORD"/>
			<arg name="SrcY" type="UWORD"/>
			<arg name="SizeX" type="UWORD"/>
			<arg name="SizeY" type="UWORD"/>
			<arg name="DestFormat" type="UBYTE"/>
		</method>
		<method name="WritePixelArray" result="ULONG">
			<arg name="srcRect" type="APTR"/>
			<arg name="SrcX" type="UWORD"/>
			<arg name="SrcY" type="UWORD"/>
			<arg name="SrcMod" type="UWORD"/>
			<arg name="RastPort" type="struct RastPort *"/>
			<arg name="DestX" type="UWORD"/>
			<arg name="DestY" type="UWORD"/>
			<arg name="SizeX" type="UWORD"/>
			<arg name="SizeY" type="UWORD"/>
			<arg name="SrcFormat" type="UBYTE"/>
		</method>
		<method name="MovePixelArray" result="ULONG">
			<arg name="SrcX" type="UWORD"/>
			<arg name="SrcY" type="UWORD"/>
			<arg name="RastPort" type="struct RastPort *"/>
			<arg name="DestX" type="UWORD"/>
			<arg name="DestY" type="UWORD"/>
			<arg name="SizeX" type="UWORD"/>
			<arg name="SizeY" type="UWORD"/>
		</method>
		<method name="Reserved6" result="void" status="unimplemented"/>
		<method name="InvertPixelArray" result="ULONG">
			<arg name="RastPort" type="struct RastPort *"/>
			<arg name="DestX" type="UWORD"/>
			<arg name="DestY" type="UWORD"/>
			<arg name="SizeX" type="UWORD"/>
			<arg name="SizeY" type="UWORD"/>
		</method>
		<method name="FillPixelArray" result="ULONG">
			<arg name="RastPort" type="struct RastPort *"/>
			<arg name="DestX" type="UWORD"/>
			<arg name="DestY" type="UWORD"/>
			<arg name="SizeX" type="UWORD"/>
			<arg name="SizeY" type="UWORD"/>
			<arg name="argb" type="ULONG"/>
		</method>
		<method name="DoCDrawMethodTagList" result="VOID">
			<arg name="hook" type="struct Hook *"/>
			<arg name="RastPort" type="struct RastPort *"/>
			<arg name="TagList" type="struct TagItem *"/>
		</method>
		<method name="DoCDrawMethodTags" result="VOID">
			<arg name="hook" type="struct Hook *"/>
			<arg name="RastPort" type="struct RastPort *"/>
			<vararg name="tag1" type="Tag"/>
		</method>
		<method name="CVideoCtrlTagList" result="VOID">
			<arg name="ViewPort" type="struct ViewPort *"/>
			<arg name="TagList" type="struct TagItem *"/>
		</method>
		<method name="CVideoCtrlTags" result="VOID">
			<arg name="ViewPort" type="struct ViewPort *"/>
			<vararg name="tag1" type="Tag"/>
		</method>
		<method name="LockBitMapTagList" result="APTR">
			<arg name="BitMap" type="APTR"/>
			<arg name="TagList" type="struct TagItem *"/>
		</method>
		<method name="LockBitMapTags" result="APTR">
			<arg name="BitMap" type="APTR"/>
			<vararg name="tag1" type="Tag"/>
		</method>
		<method name="UnLockBitMap" result="VOID">
			<arg name="Handle" type="APTR"/>
		</method>
		<method name="UnLockBitMapTagList" result="VOID">
			<arg name="Handle" type="APTR"/>
			<arg name="TagList" type="struct TagItem *"/>
		</method>
		<method name="UnLockBitMapTags" result="VOID">
			<arg name="Handle" type="APTR"/>
			<vararg name="tag1" type="Tag"/>
		</method>
		<method name="ExtractColor" result="ULONG">
			<arg name="RastPort" type="struct RastPort *"/>
			<arg name="BitMap" type="struct BitMap *"/>
			<arg name="Colour" type="ULONG"/>
			<arg name="SrcX" type="ULONG"/>
			<arg name="SrcY" type="ULONG"/>
			<arg name="Width" type="ULONG"/>
			<arg name="Height" type="ULONG"/>
		</method>
		<method name="Reserved7" result="void" status="unimplemented"/>
		<method name="WriteLUTPixelArray" result="ULONG">
			<arg name="srcRect" type="APTR"/>
			<arg name="SrcX" type="UWORD"/>
			<arg name="SrcY" type="UWORD"/>
			<arg name="SrcMod" type="UWORD"/>
			<arg name="RastPort" type="struct RastPort *"/>
			<arg name="ColorTab" type="APTR"/>
			<arg name="DestX" type="UWORD"/>
			<arg name="DestY" type="UWORD"/>
			<arg name="SizeX" type="UWORD"/>
			<arg name="SizeY" type="UWORD"/>
			<arg name="CTFormat" type="UBYTE"/>
		</method>
		<method name="Reserved8" result="void" status="unimplemented"/>
		<method name="Reserved9" result="void" status="unimplemented"/>
		<method name="WritePixelArrayAlpha" result="ULONG">
			<arg name="srcRect" type="APTR"/>
			<arg name="SrcX" type="UWORD"/>
			<arg name="SrcY" type="UWORD"/>
			<arg name="SrcMod" type="UWORD"/>
			<arg name="RastPort" type="struct RastPort *"/>
			<arg name="DestX" type="UWORD"/>
			<arg name="DestY" type="UWORD"/>
			<arg name="SizeX" type="UWORD"/>
			<arg name="SizeY" type="UWORD"/>
			<arg name="globalAlpha" type="ULONG"/>
		</method>
		<method name="BltTemplateAlpha" result="VOID">
			<arg name="srcTemplate" type="APTR"/>
			<arg name="SrcX" type="UWORD"/>
			<arg name="SrcY" type="UWORD"/>
			<arg name="RastPort" type="struct RastPort *"/>
			<arg name="DestX" type="UWORD"/>
			<arg name="DestY" type="UWORD"/>
			<arg name="SizeX" type="UWORD"/>
			<arg name="SizeY" type="UWORD"/>
		</method>
	</interface>
</library>
