<?xml version="1.0" encoding="iso-8859-1"?>
<!DOCTYPE library SYSTEM "library.dtd">
<!-- autogenerated by fdtrans v50.9 -->
<library name="usbfd" basename="USBFDBase" openname="usbfd.library">
	<include>exec/types.h</include>
	<interface name="main" version="1.0" struct="USBFDIFace" prefix="_USBFD_" asmprefix="IUSBFD" global="IUSBFD">
		<method name="Obtain" result="ULONG"/>
		<method name="Release" result="ULONG"/>
		<method name="Expunge" result="void" status="unimplemented"/>
		<method name="Clone" result="struct Interface *" status="unimplemented"/>
		<method name="USBFDGetAttrsA" result="void">
			<arg name="taglist" type="struct TagItem *"/>
		</method>
		<method name="USBFDGetAttrs" result="void">
			<vararg name="taglist" type="ULONG"/>
		</method>
		<method name="USBFDRunFunction" result="LONG">
			<arg name="startmsg" type="struct USBFDStartupMsg *"/>
		</method>
		<method name="USBFDRunInterface" result="LONG">
			<arg name="startmsg" type="struct USBFDStartupMsg *"/>
		</method>
	</interface>
</library>
