<?xml version="1.0" encoding="iso-8859-1"?>
<!DOCTYPE library SYSTEM "library.dtd">
<library name="label" basename="LabelBase" openname="images/label.image">
	<include>intuition/intuition.h</include>
	<include>intuition/classes.h</include>
	<interface name="main" version="1.0" struct="LabelIFace" prefix="_Label_" asmprefix="ILabel" global="ILabel">
		<method name="Obtain" result="ULONG"/>
		<method name="Release" result="ULONG"/>
		<method name="Expunge" result="void" status="unimplemented"/>
		<method name="Clone" result="struct Interface *" status="unimplemented"/>
		<method name="LABEL_GetClass" result="Class *">
		</method>
	</interface>
</library>
