<?xml version="1.0" encoding="iso-8859-1"?>
<!DOCTYPE library SYSTEM "library.dtd">
<!-- autogenerated by fdtrans v51.17 -->
<library name="bullet" basename="BulletBase" openname="bullet.library">
	<include>utility/tagitem.h</include>
	<include>diskfont/glyph.h</include>
	<interface name="main" version="1.0" struct="BulletIFace" prefix="_Bullet_" asmprefix="IBullet" global="IBullet">
		<method name="Obtain" result="ULONG"/>
		<method name="Release" result="ULONG"/>
		<method name="Expunge" result="void" status="unimplemented"/>
		<method name="Clone" result="struct Interface *" status="unimplemented"/>
		<method name="OpenEngine" result="struct GlyphEngine *">
		</method>
		<method name="CloseEngine" result="VOID">
			<arg name="glyphEngine" type="struct GlyphEngine *"/>
		</method>
		<method name="SetInfoA" result="ULONG">
			<arg name="glyphEngine" type="struct GlyphEngine *"/>
			<arg name="tagList" type="const struct TagItem *"/>
		</method>
		<method name="SetInfo" result="ULONG">
			<arg name="glyphEngine" type="struct GlyphEngine *"/>
			<vararg name="tag1" type="Tag"/>
		</method>
		<method name="ObtainInfoA" result="ULONG">
			<arg name="glyphEngine" type="struct GlyphEngine *"/>
			<arg name="tagList" type="const struct TagItem *"/>
		</method>
		<method name="ObtainInfo" result="ULONG">
			<arg name="glyphEngine" type="struct GlyphEngine *"/>
			<vararg name="tag1" type="Tag"/>
		</method>
		<method name="ReleaseInfoA" result="ULONG">
			<arg name="glyphEngine" type="struct GlyphEngine *"/>
			<arg name="tagList" type="const struct TagItem *"/>
		</method>
		<method name="ReleaseInfo" result="ULONG">
			<arg name="glyphEngine" type="struct GlyphEngine *"/>
			<vararg name="tag1" type="Tag"/>
		</method>
		<method name="GetGlyphMap" result="ULONG" status="private">
			<arg name="glyphEngine" type="struct GlyphEngine *"/>
			<arg name="glyphCode" type="ULONG"/>
			<arg name="glyphMap" type="struct GlyphMap **"/>
		</method>
	</interface>
</library>
