<?xml version="1.0" encoding="iso-8859-1"?>
<!DOCTYPE library SYSTEM "library.dtd">
<library name="camd" basename="CamdBase" openname="camd.library">
<interface name="main" version="1.0" flags="protected" struct="CamdIFace" prefix="_camd_" global="ICamd">
<method name="Obtain" result="uint32"></method>
<method name="Release" result="uint32"></method>
<method name="Expunge" result="void" status="unimplemented"></method>
<method name="Clone" result="struct Interface *" status="unimplemented"></method>

<method name="LockCAMD" result="APTR">
	<arg name="locktype" type="uint32"/>
</method>

<method name="UnlockCAMD" result="void">
	<arg name="lock" type="APTR"/>
</method>

<method name="CreateMidiA" result="struct MidiNode *">
	<arg name="TagList" type="struct TagItem *"/>
</method>

<method name="CreateMidi" result="struct MidiNode *">
	<arg name="" type="..."/>
</method>

<method name="DeleteMidi" result="void">
	<arg name="mn" type="struct MidiNode *"/>
</method>

<method name="SetMidiAttrsA" result="BOOL">
	<arg name="mi" type="struct MidiNode *"/>
	<arg name="tags" type="struct TagItem *"/>
</method>

<method name="SetMidiAttrs" result="BOOL">
	<arg name="mi" type="struct MidiNode *"/>
	<arg name="" type="..."/>
</method>

<method name="GetMidiAttrsA" result="uint32">
	<arg name="mi" type="struct MidiNode *"/>
	<arg name="attrs" type="struct TagItem *"/>
</method>

<method name="GetMidiAttrs" result="uint32">
	<arg name="mi" type="struct MidiNode *"/>
	<arg name="" type="..."/>
</method>

<method name="NextMidi" result="struct MidiNode *">
	<arg name="last" type="struct MidiNode *"/>
</method>

<method name="FindMidi" result="struct MidiNode *">
	<arg name="name" type="STRPTR"/>
</method>

<method name="FlushMidi" result="void">
	<arg name="mi" type="struct MidiNode *"/>
</method>

<method name="AddMidiLinkA" result="struct MidiLink *">
	<arg name="mi" type="struct MidiNode *"/>
	<arg name="type" type="int32"/>
	<arg name="TagsList" type="struct TagItem *"/>
</method>

<method name="AddMidiLink" result="struct MidiLink *">
	<arg name="mi" type="struct MidiNode *"/>
	<arg name="type" type="int32"/>
	<arg name="" type="..."/>
</method>

<method name="RemoveMidiLink" result="void">
	<arg name="ml" type="struct MidiLink *"/>
</method>

<method name="SetMidiLinkAttrsA" result="BOOL">
	<arg name="ml" type="struct MidiLink *"/>
	<arg name="tags" type="struct TagItem *"/>
</method>

<method name="SetMidiLinkAttrs" result="BOOL">
	<arg name="ml" type="struct MidiLink *"/>
	<arg name="" type="..."/>
</method>

<method name="GetMidiLinkAttrsA" result="uint32">
	<arg name="ml" type="struct MidiLink *"/>
	<arg name="attrs" type="struct TagItem *"/>
</method>

<method name="GetMidiLinkAttrs" result="uint32">
	<arg name="ml" type="struct MidiLink *"/>
	<arg name="" type="..."/>
</method>

<method name="NextClusterLink" result="struct MidiLink *">
	<arg name="mc" type="struct MidiCluster *"/>
	<arg name="last" type="struct MidiLink *"/>
	<arg name="type" type="int32"/>
</method>

<method name="NextMidiLink" result="struct MidiLink *">
	<arg name="mi" type="struct MidiNode *"/>
	<arg name="last" type="struct MidiLink *"/>
	<arg name="type" type="int32"/>
</method>

<method name="MidiLinkConnected" result="BOOL">
	<arg name="ml" type="struct MidiLink *"/>
</method>

<method name="NextCluster" result="struct MidiCluster *">
	<arg name="last" type="struct MidiCluster *"/>
</method>

<method name="FindCluster" result="struct MidiCluster *">
	<arg name="name" type="STRPTR"/>
</method>

<method name="PutMidi" result="void">
	<arg name="link" type="struct MidiLink *"/>
	<arg name="Msg" type="uint32"/>
</method>

<method name="GetMidi" result="BOOL">
	<arg name="mn" type="struct MidiNode *"/>
	<arg name="msg" type="MidiMsg *"/>
</method>

<method name="WaitMidi" result="BOOL">
	<arg name="mn" type="struct MidiNode *"/>
	<arg name="msg" type="MidiMsg *"/>
</method>

<method name="PutSysEx" result="void">
	<arg name="ml" type="struct MidiLink *"/>
	<arg name="Buffer" type="uint8 *"/>
</method>

<method name="GetSysEx" result="uint32">
	<arg name="mn" type="struct MidiNode *"/>
	<arg name="Buf" type="uint8 *"/>
	<arg name="Len" type="uint32"/>
</method>

<method name="QuerySysEx" result="uint32">
	<arg name="mn" type="struct MidiNode *"/>
</method>

<method name="SkipSysEx" result="void">
	<arg name="mn" type="struct MidiNode *"/>
</method>

<method name="GetMidiErr" result="uint8">
	<arg name="mn" type="struct MidiNode *"/>
</method>

<method name="MidiMsgType" result="int16">
	<arg name="Msg" type="MidiMsg *"/>
</method>

<method name="MidiMsgLen" result="int16">
	<arg name="StatusByte" type="uint32"/>
</method>

<method name="ParseMidi" result="void">
	<arg name="ml" type="struct MidiLink *"/>
	<arg name="Buffer" type="CONST uint8 *"/>
	<arg name="Length" type="uint32"/>
</method>

<method name="OpenMidiDevice" result="struct MidiDeviceData *">
	<arg name="Name" type="STRPTR"/>
</method>

<method name="CloseMidiDevice" result="void">
	<arg name="MidiDeviceData" type="struct MidiDeviceData *"/>
</method>

<method name="RethinkCAMD" result="int32">
</method>

<method name="StartClusterNotify" result="void">
	<arg name="cn" type="struct ClusterNotifyNode *"/>
</method>

<method name="EndClusterNotify" result="void">
	<arg name="cn" type="struct ClusterNotifyNode *"/>
</method>

</interface>
</library>

