<?xml version="1.0" encoding="iso-8859-1"?>
<!DOCTYPE library SYSTEM "library.dtd">
<library name="catweasel" basename="CWBase" openname="catweasel.resource" basetype="CWBase">
  <include>exec/types.h</include>
  <include>proto/expansion.h</include>
  <include>expansion/pci.h</include>
  <include>resources/catweasel.h</include>
  <interface name="main" version="1.0" struct="CWIFace" prefix="_CW_" asmprefix="ICW" global="ICW">
		<method name="Obtain" result="ULONG"/>
		<method name="Release" result="ULONG"/>
		<method name="Expunge" result="void" status="unimplemented"/>
		<method name="Clone" result="struct Interface *" status="unimplemented"/>
		<method name="CW3Present" result="BOOL">
		</method>
		<method name="CW4Present" result="BOOL">
		</method>
	  <method name="CW3GameportAvail" result="BOOL">
		</method>
		<method name="CW3KeyboardAvail" result="BOOL">
		</method>
	  <method name="CW3SIDAvail" result="BOOL">
	  </method>
	  <method name="CW3FloppyAvail" result="BOOL">
	  </method>
  </interface>
  <interface name="cw3gameport" version="1.0" struct="CW3GameportIFace" prefix="_CW3Gameport_" asmprefix="ICW3Gameport" global="ICW3Gameport">
    <method name="Obtain" result="ULONG"/>
    <method name="Release" result="ULONG"/>
    <method name="Expunge" result="void" status="unimplemented"/>
    <method name="Clone" result="struct Interface *" status="unimplemented"/>
    <method name="InByte" result="UBYTE">
      <arg name="offset" type="ULONG"/>
    </method>
    <method name="OutByte" result="void">
      <arg name="offset" type="ULONG"/>
      <arg name="value" type="UBYTE"/>
    </method>
  </interface> 
  <interface name="cw3keyboard" version="1.0" struct="CW3KeyboardIFace" prefix="_CW3Keyboard_" asmprefix="ICW3Keyboard" global="ICW3Keyboard">
    <method name="Obtain" result="ULONG"/>
    <method name="Release" result="ULONG"/>
    <method name="Expunge" result="void" status="unimplemented"/>
    <method name="Clone" result="struct Interface *" status="unimplemented"/>
    <method name="InByte" result="UBYTE">
      <arg name="offset" type="ULONG"/>
    </method>
    <method name="OutByte" result="void">
      <arg name="offset" type="ULONG"/>
      <arg name="value" type="UBYTE"/>
    </method>
  </interface> 
  <interface name="cw3sid" version="1.0" struct="CW3SIDIFace" prefix="_CW3SID_" asmprefix="ICW3SID" global="ICW3SID">
    <method name="Obtain" result="ULONG"/>
    <method name="Release" result="ULONG"/>
    <method name="Expunge" result="void" status="unimplemented"/>
    <method name="Clone" result="struct Interface *" status="unimplemented"/>
    <method name="InByte" result="UBYTE">
      <arg name="offset" type="ULONG"/>
    </method>
    <method name="OutByte" result="void">
      <arg name="offset" type="ULONG"/>
      <arg name="value" type="UBYTE"/>
    </method>
  </interface> 
  <interface name="cw3floppy" version="1.0" struct="CW3FloppyIFace" prefix="_CW3Floppy_" asmprefix="ICW3Floppy" global="ICW3Floppy">
    <method name="Obtain" result="ULONG"/>
    <method name="Release" result="ULONG"/>
    <method name="Expunge" result="void" status="unimplemented"/>
    <method name="Clone" result="struct Interface *" status="unimplemented"/>
    <method name="InByte" result="UBYTE">
      <arg name="offset" type="ULONG"/>
    </method>
    <method name="OutByte" result="void">
      <arg name="offset" type="ULONG"/>
      <arg name="value" type="UBYTE"/>
    </method>
  </interface> 
</library>
