<?xml version="1.0" encoding="iso-8859-1"?>
<!DOCTYPE library SYSTEM "library.dtd">
<!-- autogenerated by fdtrans v51.22 -->
<library name="nonvolatile" basename="NVBase" openname="nonvolatile.library">
	<include>exec/types.h</include>
	<include>exec/lists.h</include>
	<include>libraries/nonvolatile.h</include>
	<interface name="main" version="1.0" struct="NVIFace" prefix="_NV_" asmprefix="INV" global="INV">
		<method name="Obtain" result="uint32"/>
		<method name="Release" result="uint32"/>
		<method name="Expunge" result="void" status="unimplemented"/>
		<method name="Clone" result="struct Interface *" status="unimplemented"/>
		<method name="GetCopyNV" result="APTR">
			<arg name="appName" type="CONST_STRPTR"/>
			<arg name="itemName" type="CONST_STRPTR"/>
			<arg name="killRequesters" type="BOOL"/>
		</method>
		<method name="FreeNVData" result="VOID">
			<arg name="data" type="APTR"/>
		</method>
		<method name="StoreNV" result="UWORD">
			<arg name="appName" type="CONST_STRPTR"/>
			<arg name="itemName" type="CONST_STRPTR"/>
			<arg name="data" type="const APTR"/>
			<arg name="length" type="ULONG"/>
			<arg name="killRequesters" type="BOOL"/>
		</method>
		<method name="DeleteNV" result="BOOL">
			<arg name="appName" type="CONST_STRPTR"/>
			<arg name="itemName" type="CONST_STRPTR"/>
			<arg name="killRequesters" type="BOOL"/>
		</method>
		<method name="GetNVInfo" result="struct NVInfo *">
			<arg name="killRequesters" type="BOOL"/>
		</method>
		<method name="GetNVList" result="struct MinList *">
			<arg name="appName" type="CONST_STRPTR"/>
			<arg name="killRequesters" type="BOOL"/>
		</method>
		<method name="SetNVProtection" result="BOOL">
			<arg name="appName" type="CONST_STRPTR"/>
			<arg name="itemName" type="CONST_STRPTR"/>
			<arg name="mask" type="LONG"/>
			<arg name="killRequesters" type="BOOL"/>
		</method>
		<method name="SetUBootVar" result="ULONG">
			<arg name="name" type="CONST_STRPTR"/>
			<arg name="value" type="CONST_STRPTR"/>
		</method>
		<method name="GetUBootVar" result="CONST_STRPTR">
			<arg name="name" type="CONST_STRPTR"/>
		</method>
		<method name="FreeUBootVar" result="void">
			<arg name="value" type="CONST_STRPTR"/>
		</method>
	</interface>
</library>
