<?xml version="1.0" encoding="iso-8859-1"?>
<!DOCTYPE library SYSTEM "library.dtd">
<library name="filler" basename="FillerBase" openname="images/filler.image">
	<include>intuition/intuition.h</include>
	<include>intuition/classes.h</include>
	<interface name="main" version="1.0" struct="FillerIFace" prefix="_Filler_" asmprefix="IFiller" global="IFiller">
		<method name="Obtain" result="ULONG"/>
		<method name="Release" result="ULONG"/>
		<method name="Expunge" result="void" status="unimplemented"/>
		<method name="Clone" result="struct Interface *" status="unimplemented"/>
		<method name="FILLER_GetClass" result="Class *">
		</method>
	</interface>
</library>
