<?xml version="1.0" encoding="iso-8859-1"?>
<!DOCTYPE library SYSTEM "library.dtd">
<library name="screenblanker" basename="ScreenBlanker" openname="screenblanker.library">
<include>exec/libraries.h</include>
<include>proto/blankermodule.h</include>

<!-- The main interface which allows to make new screenblanker-instances -->
	<interface name="main" version="1.0" struct="ScreenBlankerIFace" prefix="_screenblanker_" asmprefix="IScreenBlanker" global="IScreenBlanker">

		<method name="Obtain" result="uint32">
		</method>
		
		<method name="Release" result="uint32">
		</method>
		
		<method name="Expunge" result="void" status="unimplemented">
		</method>
		
		<method name="Clone" result="struct IScreenBlanker *">
		</method>
		
		<method name="OpenBlankerModuleA" result="BOOL">
			<arg name="name" type="CONST_STRPTR"/>
			<arg name="tags" type="struct TagItem *"/>
		</method>
		
		<method name="OpenBlankerModule" result="BOOL">
			<arg name="name" type="CONST_STRPTR"/>
			<vararg name="tag1" type="Tag"/>
		</method>
		
		<method name="CloseBlankerModule" result="void"/>
		
		<method name="SetBlankingMode" result="BOOL">
			<arg name="mode" type="uint32"/>
		</method>
		
		<method name="SetScreenBlankerAttrsA" result="uint32">
			<arg name="tags" type="struct TagItem *"/>
		</method>
		
		<method name="SetScreenBlankerAttrs" result="uint32">
			<vararg name="tag1" type="Tag"/>
		</method>
		
		<method name="GetScreenBlankerAttrsA" result="uint32">
			<arg name="tags" type="struct TagItem *"/>
		</method>
		
		<method name="GetScreenBlankerAttrs" result="uint32">
			<vararg name="tag1" type="Tag"/>
		</method>

		<method name="LogPuts" result="void">
			<arg name="err" type="int32"/>
			<arg name="context" type="CONST_STRPTR"/>
			<arg name="msg" type="CONST_STRPTR"/>
		</method>

		<method name="LogFmtA" result="uint32">
			<arg name="err" type="int32"/>
			<arg name="context" type="CONST_STRPTR"/>
			<arg name="msg" type="CONST_STRPTR"/>
			<arg name="args" type="uint32 *"/>
		</method>

		<method name="LogFmt" result="uint32">
			<arg name="err" type="int32"/>
			<arg name="context" type="CONST_STRPTR"/>
			<arg name="msg" type="CONST_STRPTR"/>
			<vararg name="tag1" type="Tag"/>
		</method>

	</interface>

</library>
