<?xml version="1.0" encoding="iso-8859-1"?>
<!DOCTYPE library SYSTEM "library.dtd">
<!-- autogenerated by fdtrans v51.22 -->
<library name="amigaguide" basename="AmigaGuideBase" openname="amigaguide.library">
	<include>exec/types.h</include>
	<include>exec/ports.h</include>
	<include>dos/dos.h</include>
	<include>libraries/amigaguide.h</include>
	<include>utility/tagitem.h</include>
	<include>utility/hooks.h</include>
	<include>rexx/storage.h</include>
	<interface name="main" version="1.0" struct="AmigaGuideIFace" prefix="_AmigaGuide_" asmprefix="IAmigaGuide" global="IAmigaGuide">
		<method name="Obtain" result="uint32"/>
		<method name="Release" result="uint32"/>
		<method name="Expunge" result="void" status="unimplemented"/>
		<method name="Clone" result="struct Interface *" status="unimplemented"/>
		<method name="AGARexxHost" result="LONG" status="private">
			<arg name="rmsg" type="struct RexxMsg *"/>
			<arg name="result" type="STRPTR *"/>
		</method>
		<method name="LockAmigaGuideBase" result="LONG">
			<arg name="handle" type="APTR"/>
		</method>
		<method name="UnlockAmigaGuideBase" result="VOID">
			<arg name="key" type="LONG"/>
		</method>
		<method name="ExpungeDataBases" result="VOID" status="private">
			<arg name="flush" type="BOOL"/>
		</method>
		<method name="OpenAmigaGuideA" result="APTR">
			<arg name="nag" type="struct NewAmigaGuide *"/>
			<arg name="tags" type="struct TagItem *"/>
		</method>
		<method name="OpenAmigaGuide" result="APTR">
			<arg name="nag" type="struct NewAmigaGuide *"/>
			<vararg name="tag1" type="Tag"/>
		</method>
		<method name="OpenAmigaGuideAsyncA" result="APTR">
			<arg name="nag" type="struct NewAmigaGuide *"/>
			<arg name="attrs" type="struct TagItem *"/>
		</method>
		<method name="OpenAmigaGuideAsync" result="APTR">
			<arg name="nag" type="struct NewAmigaGuide *"/>
			<vararg name="tag1" type="Tag"/>
		</method>
		<method name="CloseAmigaGuide" result="VOID">
			<arg name="cl" type="APTR"/>
		</method>
		<method name="AmigaGuideSignal" result="ULONG">
			<arg name="cl" type="APTR"/>
		</method>
		<method name="GetAmigaGuideMsg" result="struct AmigaGuideMsg *">
			<arg name="cl" type="APTR"/>
		</method>
		<method name="ReplyAmigaGuideMsg" result="VOID">
			<arg name="amsg" type="struct AmigaGuideMsg *"/>
		</method>
		<method name="SetAmigaGuideContextA" result="LONG">
			<arg name="cl" type="APTR"/>
			<arg name="id" type="ULONG"/>
			<arg name="attrs" type="struct TagItem *"/>
		</method>
		<method name="SetAmigaGuideContext" result="LONG">
			<arg name="cl" type="APTR"/>
			<arg name="id" type="ULONG"/>
			<vararg name="tag1" type="Tag"/>
		</method>
		<method name="SendAmigaGuideContextA" result="LONG">
			<arg name="cl" type="APTR"/>
			<arg name="attrs" type="struct TagItem *"/>
		</method>
		<method name="SendAmigaGuideContext" result="LONG">
			<arg name="cl" type="APTR"/>
			<vararg name="tag1" type="Tag"/>
		</method>
		<method name="SendAmigaGuideCmdA" result="LONG">
			<arg name="cl" type="APTR"/>
			<arg name="cmd" type="STRPTR"/>
			<arg name="attrs" type="struct TagItem *"/>
		</method>
		<method name="SendAmigaGuideCmd" result="LONG">
			<arg name="cl" type="APTR"/>
			<arg name="cmd" type="STRPTR"/>
			<vararg name="tag1" type="Tag"/>
		</method>
		<method name="SetAmigaGuideAttrsA" result="LONG">
			<arg name="cl" type="APTR"/>
			<arg name="attrs" type="struct TagItem *"/>
		</method>
		<method name="SetAmigaGuideAttrs" result="LONG">
			<arg name="cl" type="APTR"/>
			<vararg name="tag1" type="Tag"/>
		</method>
		<method name="GetAmigaGuideAttr" result="LONG">
			<arg name="tag" type="Tag"/>
			<arg name="cl" type="APTR"/>
			<arg name="storage" type="ULONG *"/>
		</method>
		<method name="SetAmigaGuideHook" result="LONG" status="private">
			<arg name="cl" type="APTR"/>
			<arg name="v1" type="ULONG"/>
			<arg name="v2" type="ULONG"/>
			<arg name="v3" type="ULONG"/>
		</method>
		<method name="LoadXRef" result="LONG">
			<arg name="lock" type="BPTR"/>
			<arg name="name" type="STRPTR"/>
		</method>
		<method name="ExpungeXRef" result="VOID">
		</method>
		<method name="AddAmigaGuideHostA" result="APTR">
			<arg name="h" type="struct Hook *"/>
			<arg name="name" type="STRPTR"/>
			<arg name="attrs" type="struct TagItem *"/>
		</method>
		<method name="AddAmigaGuideHost" result="APTR">
			<arg name="h" type="struct Hook *"/>
			<arg name="name" type="STRPTR"/>
			<vararg name="tag1" type="Tag"/>
		</method>
		<method name="RemoveAmigaGuideHostA" result="LONG">
			<arg name="hh" type="APTR"/>
			<arg name="attrs" type="struct TagItem *"/>
		</method>
		<method name="RemoveAmigaGuideHost" result="LONG">
			<arg name="hh" type="APTR"/>
			<vararg name="tag1" type="Tag"/>
		</method>
		<method name="OpenE" result="BPTR" status="private">
			<arg name="path" type="BPTR"/>
			<arg name="name" type="STRPTR"/>
			<arg name="mode" type="LONG"/>
		</method>
		<method name="LockE" result="BPTR" status="private">
			<arg name="path" type="BPTR"/>
			<arg name="name" type="STRPTR"/>
			<arg name="mode" type="LONG"/>
		</method>
		<method name="CopyPathList" result="BPTR" status="private">
			<arg name="path" type="BPTR"/>
		</method>
		<method name="AddPathEntries" result="BPTR" status="private">
			<arg name="path" type="BPTR"/>
			<arg name="argptr" type="STRPTR *"/>
		</method>
		<method name="FreePathList" result="VOID" status="private">
			<arg name="path" type="BPTR"/>
		</method>
		<method name="ParsePathString" result="ULONG" status="private">
			<arg name="line" type="STRPTR"/>
			<arg name="argv" type="STRPTR *"/>
			<arg name="max" type="ULONG"/>
		</method>
		<method name="OpenDataBase" result="struct DataBase *" status="private">
			<arg name="lock" type="BPTR"/>
			<arg name="name" type="STRPTR"/>
		</method>
		<method name="LoadNode" result="LONG" status="private">
			<arg name="cl" type="APTR"/>
			<arg name="db" type="struct DataBase *"/>
			<arg name="hn" type="struct HelpNode *"/>
		</method>
		<method name="UnloadNode" result="LONG" status="private">
			<arg name="cl" type="APTR"/>
			<arg name="db" type="struct DataBase *"/>
			<arg name="hn" type="struct HelpNode *"/>
		</method>
		<method name="CloseDataBase" result="LONG" status="private">
			<arg name="db" type="struct DataBase *"/>
		</method>
		<method name="GetAmigaGuideString" result="CONST_STRPTR">
			<arg name="id" type="LONG"/>
		</method>
	</interface>
</library>
