<?xml version="1.0" encoding="iso-8859-1"?>
<!DOCTYPE library SYSTEM "library.dtd">
<library name="window" basename="WindowBase" classname="WindowClass" openname="window.class">
	<include>intuition/intuition.h</include>
	<include>intuition/classes.h</include>
	<interface name="main" version="1.0" struct="WindowIFace" prefix="_Window_" asmprefix="IWindow" global="IWindow">
		<method name="Obtain" result="ULONG"/>
		<method name="Release" result="ULONG"/>
		<method name="Expunge" result="void" status="unimplemented"/>
		<method name="Clone" result="struct Interface *" status="unimplemented"/>
		<method name="WINDOW_GetClass" result="Class *">
		</method>
		<method name="NewWindowPrefs" result="void">
		</method>
		<method name="WindowPrivate1" result="ULONG">
		</method>
		<method name="UpdateWindowPrefs" result="void">
			<arg name="screen" type="struct Screen *"/>
		</method>
	</interface>
</library>
