<?xml version="1.0" encoding="iso-8859-1"?>
<!DOCTYPE library SYSTEM "library.dtd">
<!-- autogenerated by fdtrans v50.8 -->
<library name="gadtools" basename="GadToolsBase" openname="gadtools.library">
	<include>exec/libraries.h</include>
	<include>intuition/intuition.h</include>
	<include>utility/tagitem.h</include>
	<include>libraries/gadtools.h</include>
	<interface name="main" version="1.0" struct="GadToolsIFace" prefix="_GadTools_" asmprefix="IGadTools" global="IGadTools">
		<method name="Obtain" result="ULONG"/>
		<method name="Release" result="ULONG"/>
		<method name="Expunge" result="void" status="unimplemented"/>
		<method name="Clone" result="struct Interface *" status="unimplemented"/>
		<method name="CreateGadgetA" result="struct Gadget *">
			<arg name="kind" type="ULONG"/>
			<arg name="gad" type="struct Gadget *"/>
			<arg name="ng" type="const struct NewGadget *"/>
			<arg name="taglist" type="const struct TagItem *"/>
		</method>
		<method name="CreateGadget" result="struct Gadget *">
			<arg name="kind" type="ULONG"/>
			<arg name="gad" type="struct Gadget *"/>
			<arg name="ng" type="const struct NewGadget *"/>
			<vararg name="tag1" type="Tag"/>
		</method>
		<method name="FreeGadgets" result="VOID">
			<arg name="gad" type="struct Gadget *"/>
		</method>
		<method name="GT_SetGadgetAttrsA" result="VOID">
			<arg name="gad" type="struct Gadget *"/>
			<arg name="win" type="struct Window *"/>
			<arg name="req" type="struct Requester *"/>
			<arg name="taglist" type="const struct TagItem *"/>
		</method>
		<method name="GT_SetGadgetAttrs" result="VOID">
			<arg name="gad" type="struct Gadget *"/>
			<arg name="win" type="struct Window *"/>
			<arg name="req" type="struct Requester *"/>
			<vararg name="tag1" type="Tag"/>
		</method>
		<method name="CreateMenusA" result="struct Menu *">
			<arg name="newmenu" type="const struct NewMenu *"/>
			<arg name="taglist" type="const struct TagItem *"/>
		</method>
		<method name="CreateMenus" result="struct Menu *">
			<arg name="newmenu" type="const struct NewMenu *"/>
			<vararg name="tag1" type="Tag"/>
		</method>
		<method name="FreeMenus" result="VOID">
			<arg name="menu" type="struct Menu *"/>
		</method>
		<method name="LayoutMenuItemsA" result="BOOL">
			<arg name="firstitem" type="struct MenuItem *"/>
			<arg name="vi" type="APTR"/>
			<arg name="taglist" type="const struct TagItem *"/>
		</method>
		<method name="LayoutMenuItems" result="BOOL">
			<arg name="firstitem" type="struct MenuItem *"/>
			<arg name="vi" type="APTR"/>
			<vararg name="tag1" type="Tag"/>
		</method>
		<method name="LayoutMenusA" result="BOOL">
			<arg name="firstmenu" type="struct Menu *"/>
			<arg name="vi" type="APTR"/>
			<arg name="taglist" type="const struct TagItem *"/>
		</method>
		<method name="LayoutMenus" result="BOOL">
			<arg name="firstmenu" type="struct Menu *"/>
			<arg name="vi" type="APTR"/>
			<vararg name="tag1" type="Tag"/>
		</method>
		<method name="GT_GetIMsg" result="struct IntuiMessage *">
			<arg name="iport" type="struct MsgPort *"/>
		</method>
		<method name="GT_ReplyIMsg" result="VOID">
			<arg name="imsg" type="struct IntuiMessage *"/>
		</method>
		<method name="GT_RefreshWindow" result="VOID">
			<arg name="win" type="struct Window *"/>
			<arg name="req" type="struct Requester *"/>
		</method>
		<method name="GT_BeginRefresh" result="VOID">
			<arg name="win" type="struct Window *"/>
		</method>
		<method name="GT_EndRefresh" result="VOID">
			<arg name="win" type="struct Window *"/>
			<arg name="complete" type="BOOL"/>
		</method>
		<method name="GT_FilterIMsg" result="struct IntuiMessage *">
			<arg name="imsg" type="const struct IntuiMessage *"/>
		</method>
		<method name="GT_PostFilterIMsg" result="struct IntuiMessage *">
			<arg name="imsg" type="struct IntuiMessage *"/>
		</method>
		<method name="CreateContext" result="struct Gadget *">
			<arg name="glistptr" type="struct Gadget **"/>
		</method>
		<method name="DrawBevelBoxA" result="VOID">
			<arg name="rport" type="struct RastPort *"/>
			<arg name="left" type="WORD"/>
			<arg name="top" type="WORD"/>
			<arg name="width" type="WORD"/>
			<arg name="height" type="WORD"/>
			<arg name="taglist" type="const struct TagItem *"/>
		</method>
		<method name="DrawBevelBox" result="VOID">
			<arg name="rport" type="struct RastPort *"/>
			<arg name="left" type="WORD"/>
			<arg name="top" type="WORD"/>
			<arg name="width" type="WORD"/>
			<arg name="height" type="WORD"/>
			<vararg name="tag1" type="Tag"/>
		</method>
		<method name="GetVisualInfoA" result="APTR">
			<arg name="screen" type="struct Screen *"/>
			<arg name="taglist" type="const struct TagItem *"/>
		</method>
		<method name="GetVisualInfo" result="APTR">
			<arg name="screen" type="struct Screen *"/>
			<vararg name="tag1" type="Tag"/>
		</method>
		<method name="FreeVisualInfo" result="VOID">
			<arg name="vi" type="APTR"/>
		</method>
		<method name="GTReserved0" result="VOID" status="private">
		</method>
		<method name="GTReserved1" result="VOID" status="private">
		</method>
		<method name="GTReserved2" result="VOID" status="private">
		</method>
		<method name="GTReserved3" result="VOID" status="private">
		</method>
		<method name="GTReserved4" result="VOID" status="private">
		</method>
		<method name="GTReserved5" result="VOID" status="private">
		</method>
		<method name="GT_GetGadgetAttrsA" result="LONG">
			<arg name="gad" type="struct Gadget *"/>
			<arg name="win" type="struct Window *"/>
			<arg name="req" type="struct Requester *"/>
			<arg name="taglist" type="const struct TagItem *"/>
		</method>
		<method name="GT_GetGadgetAttrs" result="LONG">
			<arg name="gad" type="struct Gadget *"/>
			<arg name="win" type="struct Window *"/>
			<arg name="req" type="struct Requester *"/>
			<vararg name="tag1" type="Tag"/>
		</method>
	</interface>
</library>
