<?xml version="1.0" encoding="iso-8859-1"?>
<!DOCTYPE library SYSTEM "library.dtd">
<!-- autogenerated by fdtrans v50.9 -->
<library name="resource" basename="ResourceBase" openname="resource.library">
	<include>libraries/resource.h</include>
	<include>intuition/classusr.h</include>
	<include>intuition/intuition.h</include>
	<include>libraries/locale.h</include>
	<include>utility/tagitem.h</include>
	<interface name="main" version="1.0" struct="ResourceIFace" prefix="_Resource_" asmprefix="IResource" global="IResource">
		<method name="Obtain" result="ULONG"/>
		<method name="Release" result="ULONG"/>
		<method name="Expunge" result="void" status="unimplemented"/>
		<method name="Clone" result="struct Interface *" status="unimplemented"/>
		<method name="RL_OpenResource" result="RESOURCEFILE">
			<arg name="resource" type="APTR"/>
			<arg name="screen" type="struct Screen *"/>
			<arg name="catalog" type="struct Catalog *"/>
		</method>
		<method name="RL_CloseResource" result="VOID">
			<arg name="resfile" type="RESOURCEFILE"/>
		</method>
		<method name="RL_NewObjectA" result="Object *">
			<arg name="resfile" type="RESOURCEFILE"/>
			<arg name="resid" type="RESOURCEID"/>
			<arg name="tags" type="struct TagItem *"/>
		</method>
		<method name="RL_NewObject" result="Object *">
			<arg name="resfile" type="RESOURCEFILE"/>
			<arg name="resid" type="RESOURCEID"/>
			<vararg name="tag1" type="Tag"/>
		</method>
		<method name="RL_DisposeObject" result="VOID">
			<arg name="resfile" type="RESOURCEFILE"/>
			<arg name="obj" type="Object *"/>
		</method>
		<method name="RL_NewGroupA" result="Object **">
			<arg name="resfile" type="RESOURCEFILE"/>
			<arg name="id" type="RESOURCEID"/>
			<arg name="taglist" type="struct TagItem *"/>
		</method>
		<method name="RL_NewGroup" result="Object **">
			<arg name="resfile" type="RESOURCEFILE"/>
			<arg name="id" type="RESOURCEID"/>
			<vararg name="tag1" type="Tag"/>
		</method>
		<method name="RL_DisposeGroup" result="VOID">
			<arg name="resfile" type="RESOURCEFILE"/>
			<arg name="obj" type="Object **"/>
		</method>
		<method name="RL_GetObjectArray" result="Object **">
			<arg name="resfile" type="RESOURCEFILE"/>
			<arg name="obj" type="Object *"/>
			<arg name="id" type="RESOURCEID"/>
		</method>
		<method name="RL_SetResourceScreen" result="BOOL">
			<arg name="resfile" type="RESOURCEFILE"/>
			<arg name="screen" type="struct Screen *"/>
		</method>
	</interface>
</library>
