<?xml version="1.0" encoding="iso-8859-1"?>
<!DOCTYPE library SYSTEM "library.dtd">
<!-- autogenerated by fdtrans v51.22 -->
<library name="amigainput" basename="AIN_Base" openname="amigainput.library">
	<include>amigainput/amigainput.h</include>
	<include>utility/tagitem.h</include>
	<interface name="main" version="1.0" struct="AIN_IFace" prefix="_AIN__" asmprefix="IAIN_" global="IAIN_">
		<method name="Obtain" result="uint32"/>
		<method name="Release" result="uint32"/>
		<method name="Expunge" result="void" status="unimplemented"/>
		<method name="Clone" result="struct Interface *" status="unimplemented"/>
		<method name="AIN_GetError" result="ULONG">
			<arg name="ctx" type="APTR"/>
		</method>
		<method name="AIN_GetErrorString" result="STRPTR">
			<arg name="error_code" type="ULONG"/>
		</method>
		<method name="AIN_CreateContext" result="APTR">
			<arg name="api_version" type="ULONG"/>
			<arg name="tags" type="struct TagItem *"/>
		</method>
		<method name="AIN_DeleteContext" result="VOID">
			<arg name="ctx" type="APTR"/>
		</method>
		<method name="AIN_EnumDevices" result="BOOL">
			<arg name="ctx" type="APTR"/>
			<arg name="enumfunc" type="APTR"/>
			<arg name="user_data" type="APTR"/>
		</method>
		<method name="AIN_Query" result="BOOL">
			<arg name="ctx" type="APTR"/>
			<arg name="device_id" type="AIN_DeviceID"/>
			<arg name="qParameter" type="ULONG"/>
			<arg name="qArg" type="ULONG"/>
			<arg name="result" type="APTR"/>
			<arg name="result_length" type="ULONG"/>
		</method>
		<method name="AIN_ObtainDevice" result="AIN_DeviceHandle *">
			<arg name="ctx" type="APTR"/>
			<arg name="device_id" type="AIN_DeviceID"/>
		</method>
		<method name="AIN_ReleaseDevice" result="VOID">
			<arg name="ctx" type="APTR"/>
			<arg name="handle" type="AIN_DeviceHandle *"/>
		</method>
		<method name="AIN_SetDeviceParameter" result="BOOL">
			<arg name="ctx" type="APTR"/>
			<arg name="handle" type="AIN_DeviceHandle *"/>
			<arg name="dParameter" type="ULONG"/>
			<arg name="dArg" type="ULONG"/>
		</method>
		<method name="AIN_GetEvent" result="AIN_InputEvent *">
			<arg name="ctx" type="APTR"/>
		</method>
		<method name="AIN_FreeEvent" result="VOID">
			<arg name="ctx" type="APTR"/>
			<arg name="event" type="AIN_InputEvent *"/>
		</method>
		<method name="AIN_ReadDevice" result="BOOL">
			<arg name="ctx" type="APTR"/>
			<arg name="handle" type="AIN_DeviceHandle *"/>
			<arg name="data" type="APTR *"/>
		</method>
		<method name="AIN_Set" result="BOOL">
			<arg name="ctx" type="APTR"/>
			<arg name="tags" type="struct TagItem *"/>
		</method>
		<method name="AIN_RequestDevice" result="struct _AIN_RequesterResult *">
			<arg name="ctx" type="APTR"/>
			<arg name="tags" type="struct TagItem *"/>
		</method>
		<method name="AIN_FreeRequest" result="VOID">
			<arg name="ctx" type="APTR"/>
			<arg name="result" type="struct _AIN_RequesterResult *"/>
		</method>
	</interface>
</library>
