<?xml version="1.0" encoding="iso-8859-1"?>
<!DOCTYPE library SYSTEM "library.dtd">
<!-- autogenerated by fdtrans v50.9 -->
<library name="potgo" basename="PotgoBase" openname="potgo.library">
	<include>exec/types.h</include>
	<interface name="main" version="1.0" struct="PotgoIFace" prefix="_Potgo_" asmprefix="IPotgo" global="IPotgo">
		<method name="Obtain" result="ULONG"/>
		<method name="Release" result="ULONG"/>
		<method name="Expunge" result="void" status="unimplemented"/>
		<method name="Clone" result="struct Interface *" status="unimplemented"/>
		<method name="AllocPotBits" result="UWORD">
			<arg name="bits" type="UWORD"/>
		</method>
		<method name="FreePotBits" result="VOID">
			<arg name="bits" type="UWORD"/>
		</method>
		<method name="WritePotgo" result="VOID">
			<arg name="word" type="UWORD"/>
			<arg name="mask" type="UWORD"/>
		</method>
	</interface>
</library>
